{
  "actor_projection_refs": [
    "actor-context:quote_acme:finance@v2",
    "actor-context:quote_acme:gtm@v2",
    "actor-context:quote_acme:legal@v2",
    "actor-context:quote_acme:product@v2",
    "actor-context:quote_acme:renderer@v1"
  ],
  "coalition_plan_ref": "coalition:quote_acme@v1",
  "created_at": "2026-08-15T00:00:00Z",
  "digest": "sha256:70296cba804b541632a782d9ba6b27639b5eeebf5ceb994c01f2cbb9d5811dc0",
  "expires_at": "2026-08-16T23:59:59Z",
  "id": "task-context:quote_acme",
  "organization_id": "org:northstar",
  "revision_lock": {
    "authorization": "authz:workspace@r1",
    "graph": "graph:workspace@seed-r1",
    "policy": "policy:workspace@r1",
    "runtime_registry": "runtime:workspace@r1",
    "skill_registry": "skills:registry@r1"
  },
  "slot_bindings": [
    {
      "admission_decision_ref": "admission:quote_acme:currency@v1",
      "claim_scope": "ORGANIZATION",
      "digest": "sha256:8349c80b281c70a3a218518d537cb0e1328641c97734e06da70f6847de91c139",
      "expires_at": "2026-08-16T23:59:59Z",
      "object_digest": "sha256:594513554f861edb2fe5d959d0200b3461e29d9a35968966acf2fe762be748ad",
      "object_ref": "policy:finance.currency@v1",
      "projection": "USD",
      "projection_digest": "sha256:82bb059ec10744f31e0406b8ef7a7a0f3c30c9b18435120fa859b2c0b9627888",
      "projection_schema_ref": "schema:workspace.currency@v1",
      "purpose": "enterprise_quote",
      "recipient_ids": [
        "finance-steward",
        "workspace-renderer"
      ],
      "relation": "REQUIRES_POLICY",
      "semantic_kind": "POLICY",
      "slot_id": "currency",
      "strength": "HARD"
    },
    {
      "admission_decision_ref": "admission:quote_acme:data_residency@v1",
      "claim_scope": "ORGANIZATION",
      "digest": "sha256:5e55d1b9265d639cc221426510549fe7d0715befb47d6ff66dad9de30f93e3d1",
      "expires_at": "2026-08-16T23:59:59Z",
      "object_digest": "sha256:8a6796400928f80ee43939006dc5c9ee6c74698bdfe98c40cfcbf78ae30a4582",
      "object_ref": "claim:product.residency_capability@v3",
      "projection": "US region supported",
      "projection_digest": "sha256:2251046a21fd91d42c6afa3aa8d4fb04ed0b15a5bf2ed6b288bf8c1af22175d8",
      "projection_schema_ref": "schema:workspace.data_residency@v1",
      "purpose": "enterprise_quote",
      "recipient_ids": [
        "product-steward",
        "workspace-renderer"
      ],
      "relation": "REQUIRES_CLAIM",
      "semantic_kind": "CLAIM",
      "slot_id": "data_residency",
      "strength": "HARD"
    },
    {
      "admission_decision_ref": "admission:quote_acme:launch_date@v1",
      "claim_scope": "ORGANIZATION",
      "digest": "sha256:89bd86ab45a5af40e490eccd8bcb4d21b1a22e3b9680aaf6a85ff6b91f4ceee4",
      "expires_at": "2026-08-16T23:59:59Z",
      "object_digest": "sha256:7409961c7b688c9b8feff96a32dab38ae8441a00bc87766454faa781a6001ce6",
      "object_ref": "claim:product.launch_date@v7",
      "projection": "2026-09-01",
      "projection_digest": "sha256:fe1457d8f8c5911fca219c2ab9d7bf2bfbf4f72cc8920718487bff31a343b43c",
      "projection_schema_ref": "schema:workspace.launch_date@v1",
      "purpose": "enterprise_quote",
      "recipient_ids": [
        "product-steward",
        "workspace-renderer"
      ],
      "relation": "REQUIRES_CLAIM",
      "semantic_kind": "CLAIM",
      "slot_id": "launch_date",
      "strength": "HARD"
    },
    {
      "admission_decision_ref": "admission:quote_acme:notice_required@v1",
      "claim_scope": "ORGANIZATION",
      "digest": "sha256:696aaa970cd65eb4321f9a44e1bb777a373267c799d8e337e0872ba19390ca7b",
      "expires_at": "2026-08-16T23:59:59Z",
      "object_digest": "sha256:a04a1e9b7aa3d422daf5e122614d0f65e5db6ae9b3c9471492f54f88d4ec5c62",
      "object_ref": "claim:legal.customer_notice_required@v3",
      "projection": true,
      "projection_digest": "sha256:b5bea41b6c623f7c09f1bf24dcae58ebab3c0cdd90ad966bc43a45b44867e12b",
      "projection_schema_ref": "schema:workspace.notice_required@v1",
      "purpose": "enterprise_quote",
      "recipient_ids": [
        "legal-steward",
        "workspace-renderer"
      ],
      "relation": "REQUIRES_CLAIM",
      "semantic_kind": "CLAIM",
      "slot_id": "notice_required",
      "strength": "HARD"
    },
    {
      "admission_decision_ref": "admission:quote_acme:partner_terms@v1",
      "claim_scope": "ORGANIZATION",
      "digest": "sha256:567b252fa8695be49f7e03038e8a4c66868e6bcbff6b3c9630c1a57d82889050",
      "expires_at": "2026-08-16T23:59:59Z",
      "object_digest": "sha256:68f43f6474a5d21351ec3c1cbde570f7dc987ab6fa53ddb4ba63455ae2120e7d",
      "object_ref": "claim:gtm.partner_terms@v2",
      "projection": "legal-review",
      "projection_digest": "sha256:9495ac6d1184e70c2067c665a555c4d2428e395e322f3f39d3f0a5c7403e7d50",
      "projection_schema_ref": "schema:workspace.partner_terms@v1",
      "purpose": "enterprise_quote",
      "recipient_ids": [
        "gtm-steward",
        "workspace-renderer"
      ],
      "relation": "REQUIRES_CLAIM",
      "semantic_kind": "CLAIM",
      "slot_id": "partner_terms",
      "strength": "REVIEW"
    },
    {
      "admission_decision_ref": "admission:quote_acme:price_band@v1",
      "claim_scope": "ORGANIZATION",
      "digest": "sha256:64b1c2e20cf348981d2744e328261c3fdf20a19e24149798fde848e780b723e8",
      "expires_at": "2026-08-16T23:59:59Z",
      "object_digest": "sha256:7e69bcaf05264ba6a43c611a6f5765eff3add3de51c402930dd3afb1896835bb",
      "object_ref": "policy:finance.price_band@v7",
      "projection": "strategic",
      "projection_digest": "sha256:40132f1a582dff6428b46fdf0f9ccfeed3d8fdc64e2b8885e290c2b37a6f50c2",
      "projection_schema_ref": "schema:workspace.price_band@v1",
      "purpose": "enterprise_quote",
      "recipient_ids": [
        "finance-steward",
        "workspace-renderer"
      ],
      "relation": "REQUIRES_POLICY",
      "semantic_kind": "POLICY",
      "slot_id": "price_band",
      "strength": "REVIEW"
    },
    {
      "admission_decision_ref": "admission:quote_acme:product_plan@v1",
      "claim_scope": "ORGANIZATION",
      "digest": "sha256:19670e3fbce8243e50a6f2a81d3073376da9fd7e75951aa0199d6f5dd94223b8",
      "expires_at": "2026-08-16T23:59:59Z",
      "object_digest": "sha256:e8d44a3ce710e6445301b3d52e8f19be1c36dc7ecfe775ea827201fee9710a0a",
      "object_ref": "claim:product.enterprise_plan@v4",
      "projection": "enterprise-plan-v4",
      "projection_digest": "sha256:f491e3a95f7ea7d725f68dc7a7610aebbaebbbddc6203163d013db0f72e66618",
      "projection_schema_ref": "schema:workspace.product_plan@v1",
      "purpose": "enterprise_quote",
      "recipient_ids": [
        "product-steward",
        "workspace-renderer"
      ],
      "relation": "REQUIRES_CLAIM",
      "semantic_kind": "CLAIM",
      "slot_id": "product_plan",
      "strength": "HARD"
    },
    {
      "admission_decision_ref": "admission:quote_acme:quote_compose_skill@v1",
      "claim_scope": "ORGANIZATION",
      "digest": "sha256:25d4b58eaa0a9435329221cea8bff09885515cab05af1a8217fded15c5884210",
      "expires_at": "2026-08-16T23:59:59Z",
      "object_digest": "sha256:faa5ea2df973806222ac217660ad7f1db828f0c0a57dcbcc9e44d3da74142064",
      "object_ref": "skill:enterprise-quote-compose@1.0",
      "projection": "skill:enterprise-quote-compose@1.0",
      "projection_digest": "sha256:079eb3ee6f7c3fd44ef8252d6101789def457d09073d94410e4f06110dd7fa71",
      "projection_schema_ref": "schema:workspace.quote_compose_skill@v1",
      "purpose": "enterprise_quote",
      "recipient_ids": [
        "gtm-steward",
        "workspace-renderer"
      ],
      "relation": "REQUIRES_SKILL",
      "semantic_kind": "SKILL",
      "slot_id": "quote_compose_skill",
      "strength": "HARD"
    }
  ],
  "task_ref": "task:quote_acme",
  "template_ref": "template:enterprise_quote@v1",
  "version": "v1"
}
